{
  "account_access_result": "BLOCKED_NO_CREDENTIAL_AVAILABLE",
  "audit_date": "2026-07-13",
  "audit_status": "BLOCKED_NO_CREDENTIAL_AVAILABLE",
  "credential_committed": false,
  "credential_material_recorded": false,
  "credential_present": false,
  "documentation_sources": [
    "https://platform.openai.com/docs/api-reference/models/object",
    "https://openai.com/index/introducing-gpt-5-4-mini-and-nano/"
  ],
  "error_class": null,
  "error_message_summary": null,
  "final_authorization_status": "BLOCKED",
  "http_result_class": "NOT_ATTEMPTED",
  "human_coding_status": "BLOCKED",
  "inference_performed": false,
  "metadata_endpoint_class": "GET /v1/models/{model}",
  "metadata_request_performed": false,
  "model_execution_status": "BLOCKED",
  "operating_system_class": "Darwin",
  "overall_execution_status": "EXECUTION_BLOCKED",
  "pricing_status": "BLOCKED_PENDING_POINT_IN_TIME_PRICING_FREEZE",
  "private_content_transmitted": false,
  "private_packet_accessed": false,
  "prompt_transmitted": false,
  "provider": "OpenAI",
  "provider_account_gate_status": "BLOCKED",
  "provider_owned_by": null,
  "provider_owned_by_suppressed": false,
  "python_version": "3.11.9",
  "record_hash": "sha256:70f5ac736e2650db82cbbf87ec75d49ad176a2664f3f872d277f8cb93fd7a483",
  "record_version": "provider_model_account_verification_v0_2",
  "request_timestamp": null,
  "requested_model_identifier": "gpt-5.4-mini",
  "responses_api_called": false,
  "returned_model_identifier": null,
  "runtime_gate_status": "BLOCKED_PENDING_SYNTHETIC_NO_SOURCE_INFERENCE_VERIFICATION",
  "schema_version": "0.2.0",
  "sdk_version": "not_installed"
}
